{
  "name": "pr-remediate",
  "version": "0.3.0",
  "status": "active",
  "cost_class": "large",
  "owners": [
    "ren",
    "nadia"
  ],
  "improvement_agent": "sana",
  "created_at": "2026-07-29",
  "requires": [
    "github.token",
    "workforce.dispatch_token"
  ],
  "deliverable": {
    "type": "external-pr",
    "publish_notion": false
  }
}
