{
  "name": "issue-execute",
  "version": "0.1.0",
  "status": "active",
  "cost_class": "large",
  "owners": [
    "ren",
    "dario"
  ],
  "improvement_agent": "sana",
  "created_at": "2026-10-05",
  "requires": [
    "github.token",
    "workforce.dispatch_token"
  ],
  "deliverable": {
    "type": "external-pr",
    "publish_notion": false
  }
}
