{
  "name": "feed-post",
  "version": "0.3.0",
  "status": "active",
  "archetype": "cadence",
  "deliverable": {
    "type": "notification",
    "publish_notion": false
  },
  "cost_class": "small",
  "owners": [
    "aanya",
    "aoi",
    "astrid",
    "dario",
    "elena",
    "farah",
    "freya",
    "grace",
    "hana",
    "ishaan",
    "kai",
    "levi",
    "mateo",
    "maya",
    "mei",
    "mira",
    "nadia",
    "noor",
    "priya",
    "ren",
    "sana",
    "sora",
    "tessa",
    "theo",
    "vikram",
    "yuki"
  ],
  "improvement_agent": "sana",
  "created_at": "2026-05-27",
  "requires": [
    "workforce.feed_write_token"
  ]
}
