{
  "name": "podcast-script",
  "version": "0.5.0",
  "status": "active",
  "archetype": "cadence",
  "deliverable": {
    "type": "article",
    "publish_notion": false,
    "article_type": "analysis"
  },
  "cost_class": "medium",
  "owners": ["rhys", "idris"],
  "improvement_agent": "sana",
  "created_at": "2026-06-28",
  "requires": ["notion.integration_token"]
}
