{
  "name": "podcast-publish",
  "version": "0.4.0",
  "status": "active",
  "archetype": "cadence",
  "deliverable": {
    "type": "notification",
    "publish_notion": false
  },
  "cost_class": "small",
  "owners": ["celeste", "odette"],
  "improvement_agent": "sana",
  "created_at": "2026-06-29",
  "requires": ["notion.integration_token", "github.token"]
}
