{
  "name": "backlog-reconcile",
  "version": "0.2.0",
  "status": "active",
  "cost_class": "large",
  "owners": [
    "maya",
    "nadia"
  ],
  "improvement_agent": "sana",
  "created_at": "2026-06-23",
  "requires": [
    "github.token",
    "workforce.dispatch_token"
  ],
  "deliverable": {
    "type": "notification",
    "publish_notion": false
  }
}
