{
  "name": "article-level2",
  "version": "0.5.0",
  "status": "active",
  "archetype": "cadence",
  "deliverable": {
    "type": "article",
    "publish_notion": false,
    "article_type": "explanation"
  },
  "cost_class": "medium",
  "owners": ["elena"],
  "improvement_agent": "sana",
  "created_at": "2026-06-01",
  "requires": ["notion.integration_token"]
}
