{
  "name": "ops-accountability-watch",
  "version": "0.1.1",
  "status": "active",
  "archetype": "cadence",
  "deliverable": {
    "type": "notification",
    "publish_notion": false
  },
  "cost_class": "small",
  "owners": ["petra"],
  "improvement_agent": null,
  "created_at": "2026-07-23",
  "requires": ["github.token", "discord.webhook_url"]
}
