{
  "name": "issue-implement",
  "version": "0.3.0",
  "status": "archived",
  "cost_class": "large",
  "owners": [
    "ren"
  ],
  "improvement_agent": "sana",
  "created_at": "2026-07-22",
  "requires": [
    "github.token",
    "workforce.dispatch_token"
  ],
  "deliverable": {
    "type": "external-pr",
    "publish_notion": false
  }
}
