{
  "name": "hypothesis",
  "version": "0.2.1",
  "status": "active",
  "archetype": "cadence",
  "deliverable": {
    "type": "article",
    "publish_notion": false,
    "article_type": "analysis"
  },
  "cost_class": "medium",
  "owners": [
    "maya"
  ],
  "improvement_agent": "sana",
  "created_at": "2026-07-03",
  "requires": [
    "notion.integration_token"
  ]
}
