{
  "name": "pr-autopilot",
  "version": "0.35.0",
  "status": "active",
  "cost_class": "medium",
  "owners": [
    "nadia",
    "maya"
  ],
  "improvement_agent": "sana",
  "created_at": "2026-05-30",
  "requires": [
    "github.token",
    "workforce.dispatch_token"
  ],
  "deliverable": {
    "type": "external-pr-merge",
    "publish_notion": false
  }
}
