{
  "name": "article-level3",
  "version": "0.2.0",
  "status": "active",
  "archetype": "cadence",
  "deliverable": {
    "type": "article",
    "publish_notion": false,
    "article_type": "analysis"
  },
  "cost_class": "large",
  "owners": [
    "elena"
  ],
  "improvement_agent": "sana",
  "created_at": "2026-06-04",
  "requires": [
    "notion.integration_token"
  ]
}
