{
  "name": "issue-triage",
  "version": "0.5.0",
  "status": "active",
  "cost_class": "medium",
  "owners": [
    "nadia",
    "maya"
  ],
  "improvement_agent": "sana",
  "created_at": "2026-07-29",
  "requires": [
    "github.token",
    "workforce.dispatch_token"
  ],
  "deliverable": {
    "type": "notification",
    "publish_notion": false
  }
}
