{
  "name": "dependabot-triage",
  "version": "0.1.0",
  "status": "active",
  "archetype": "cadence",
  "deliverable": {
    "type": "external-pr-merge",
    "publish_notion": false
  },
  "cost_class": "medium",
  "owners": [
    "farah",
    "nadia"
  ],
  "improvement_agent": "sana",
  "created_at": "2026-06-16",
  "requires": [
    "github.token"
  ]
}
